,text,dial,reg,eng,intent
122658,이렇게 계속 인제 온난 지구 온난화라든가 뭐 이렇게 모든 게 환경이,이케 계속 인제 온난 지구 온난화라든가 뭐 이렇게 모든 게 환경이,cc,"It's just that, you know, it's like, you know, it's like, you know, it's like, you know, it's like, you know, it's like, you know, it's like, you know, it's like, you know, it's like, you know, it's like, you know, it's like, you know, it's like, you know, it's like, you know, it's like, you know, it's like, you know, it's like, you know, it's like, you know, it's like, you know, it's like, you know, it's like, you know, it's like, you know, it's like, you know, you know, you know, you know, you know, you know, it's like, you know, you know, you know, you know, you know, you know, you know, you know, you know, you know, you know, you know, you know, you know, you know, you know, you know, you know, you know, you know, you know, you know, you know, you know, you know, you know, you know, you know, you know, you know, you know, you know, you know, you know, you know, you know, it're, you know, you know, you know, you know, you know, you know, you know, you know, you know, you know, you know, you know, you know, you know, you know, you know, you know, you know, you know, you know, you know, you know, you know, you know, you know, you know, you know, you know, you know, it're, you know, you know, you know, you know, you know, you know, you know, you know, you know, you know, you know, you know, you know, you know, you know, you know, you know, you know, you know, you know, you know, you know, you know, you know, you know, you know, you know, you know, you know, you know, you know, you know, you know, you know, you know, you know, you know"," Like this, global warming or something like this, everything is the environment"
116474,정말로 이렇게 학생이 말한 것처럼,정말로 이케 학생이 말한 것처럼,cc,"Really, like you said,", Just like the student said
114969,특별히 뭐 기억에 남는 것도 없고 근데 이제 그 이렇게 선물이라고 딱 얘기하면,특별히 뭐 기억에 남는 것도 없고 근데 이제 그 이케 선물이라고 딱 얘기하면,cc,"I don't remember anything in particular, but if you say it's a gift like this,"," There's nothing particularly memorable, but now if you just say it's a gift like this"
210917,어디 어디서 파는 그 고로케가 먹고 싶어 이렇게 탁 이게 나온단 말이죠.,어디 어디서 파는 그 고로케가 먹고 싶어 이르케 탁 이게 나온단 말이죠.,cc,I'd like to eat that goroke somewhere and I'd like to see it come out like this.," want to eat that croquette that is sold somewhere, and this pops out like this."
119485,그런 플랫폼이 조금 많았어요.,그런 플랫폼이 쫌 많았어요.,cc,There were a lot of them., There were a few platforms like that.
100562,어~ 부식따라 옮겨다니는 것들이 조금 많아요 그리고,어~ 부식따라 옮겨다니는 것들이 쫌 많아요 그리고,cc,"Uh, there's a little bit of humus stuff that goes around, and..."," Uh, there are a lot of things moving around along the corrosion, and"
109350,친구들이 가자고 하는 곳으로 간다던지 공부할 때는 조금 조용한 곳이나,친구들이 가자고 하는 곳으로 간다던지 공부할 때는 쫌 조용한 곳이나,cc,"You go where your friends ask you to go, or when you're studying, it's a little quiet."," Go where your friends ask you to go, or go to a quiet place when studying"
115143,근데 그~ 예전에 만났던 애가 조금 멀리 살았는데,근데 그~ 예전에 만났던 애가 쫌 멀리 살았는데,cc,But the kid I met before lived a little far away., But the girl I met before lived a little far away.
108963,그~ 핸드 메이드 조금 많이 만들으셨다고 하는데,그~ 핸드 메이드 쫌 많이 만들으셨다고 하는데,cc,I hear you made a few hand maids., He said that he made a lot of handmade things.
103609,조금 자상한 스타일이라던가 뭐~ 이런 스타일로 그러면은,쫌 자상한 스타일이라던가 뭐~ 이런 스타일로 그러면은,cc,I don't know if it's kind of nice or something like that., A little caring style or something like this
144706,그냥 귀찮아서 안 할 때가 있어요 그러니까 귀찮음의 대,그냥 귀찮아서 안 할 때가 있어요 긍까 귀찮음의 대,cc,"I just don't want to bother you, so I don't want to bother you.", There are times when I just don't do it because it's annoying
114625,그래도 이렇게 잘 갖춰서 입으래면은 혹시 돈이 많이 들어가지 않을까 했는데,그래도 이케 잘 갖춰서 입으래면은 혹시 돈이 많이 들어가지 않을까 했는데,cc,"But if you want to dress up like this, it's probably going to cost you a lot of money."," Still, I wondered if I would spend a lot of money if I wanted to wear it well."
112341,조금 좋았다고 하기도 그렇고 싫었다고 하기도 그런 좀 특이한 경험이 있는데,쫌 좋았다고 하기도 그렇고 싫었다고 하기도 그런 좀 특이한 경험이 있는데,cc,"It's kind of weird to say that I liked it a little bit, or that I didn't want to do it.", I had a rather unusual experience that I could say was a little good or a little disliked.
120952,손으로 뜨는 그때 마크라메를 해본 적이 있는데 그 날 조금 힘들었어요 왜 힘들었나 생각을 해보니까,손으로 뜨는 그때 마크라메를 해본 적이 있는데 그 날 쫌 힘들었어요 왜 힘들었나 생각을 해보니까,cc,"I tried Mark Lame when I woke up, and it was a little hard that day because I thought about why it was so hard."," I tried macrame when I was knitting by hand, but that day was a bit difficult. I thought about why it was so difficult."
103608,왜냐하면 옛날에는 저기 대전서 유성 오려면 시골길로 시골길로 해서 왔었어 그런데 거기를 꼭 지났지.,왜냐하면 옛날에는 저기 대전서 유성 올라믄 시골길로 시골길로 해서 왔었어 그런디 거기를 꼭 지났지.,cc,"Because in the old days, if you wanted to come to the Great War, you'd come to the country by the way, but you'd have to go there.","Because in the old days, to come from Daejeon to Yuseong, I had to take a country road to a country road, but I just passed there."
122790,진짜 등뼈도 이 시래기가 중요한 거 같애.,진짜 등뼈도 이 씨래기가 중요한 거 같애.,cc,I think the real stapes are important., I think this siraegi is also important for the real backbone.
100354,그래서 돌아다니면서 여기는 이런 곳이 있구나 저긴 이런 곳이 있구나 하면서,그래서 돌아댕기면서 여기는 이런 곳이 있구나 저긴 이런 곳이 있구나 하면서,cc,"So you walk around, and you see a place like this, and you say there's a place like this.", So I went around and thought that there is a place like this here and there is a place like this over there.
114223,맨날 술에 취하던가 아니면 기분이 좋을 때 댄스 음악으로 메들리를 하곤 하는데,맨날 술에 취하던가 아니면 기분이 좋을 때 댄스 음악으로 메들리를 하곤 하는디,cc,"You're either drunk all the time, or you're playing medley when you're in a good mood.", I always do a medley with dance music when I'm drunk or when I'm in a good mood.
121201,뭐 서로 섞이면서 이게 잘 조화가 되겠지?,뭐 서로 썪이면서 이게 잘 조화가 되겄지?,cc,"It's going to be in harmony, right?", What will this mix well with each other?
208429,그냥 있으니까 꼭 그게 어릴때 꿈과 일치된 것만은 꼭 아니구나라고 생각을 하고,그냥 있으니께 꼭 그게 어릴때 꿈과 일치된 것만은 꼭 아니구나라고 생각을 하고,cc,I think it's more than just a dream when I was a kid.," Just because it's there, I think that it's not necessarily the same as my childhood dream."
104309,사회주의가 또 돼가는 거야.,사회주의가 또 돼가는 거여.,cc,Socialism is going on again., Socialism is going again.
123642,그냥 매번 수업 시간마다 넋이 나갔어.,걍 매번 수업 시간마다 너갱이가 나갔어.,cc,I'm just bored every class session., I just went crazy every class.
109985,그러니까 걔는 그게 자기는 코는 콤플렉스지만은 피부는 장점인 거야 자기 갖고 있는 거 있는 거예요 그러니까,그니까 걔는 그게 자기는 코는 콤플렉스지만은 피부는 장점인 거야 자기 갖고 있는 거 있는 거예요 그러니까,cc,"So he thinks it's his nose complex, but his skin is his skin."," That's why he says that he has a nose complex, but his skin is his strength."
118135,되게 좀 독특하고 시 쪼끔 심오한 이야기들을 조금 많이 선호하는,되게 좀 독특하고 시 쪼끔 심오한 이야기들을 쫌 많이 선호하는,cc,"It's a little bit of a unique, little bit of a fancy story, and it's a little bit of a little bit of a favorite story.", I prefer a little bit of unique and profound stories.
132202,그런 조금 이제 감정적이거나 이런 것들 감정을 조금 공감을 잘하고,그런 쫌 이제 감정적이거나 이런 것들 감정을 쫌 공감을 잘하고,gs,"Now I'm a little emotional, or I'm a little empathic about these things.","I'm a little emotional now, or I'm good at empathizing with these feelings"
126840,그것도 있고 약간 가게에서 일하면은 사람들 말하는 거 다 듣게 되잖아 그래 가지고 또 진짜,그것도 있고 약간 가게에서 일하면은 사람들 말하는 거 다 듣게 되잖아 그래 가주고 또 진짜,gs,"And if you work in the store a little bit, you'll hear what people say."," There's that, and if you work at a store for a bit, you'll hear everything people say."
204102,다 보면 옛날에 기존에 사람들 번역해 논 거 그거 쪼끔 말씨만 그거 바꾸고 그래 가지고 책을 만들어 가지고 자기가 마치 창작하듯,다 보면 옛날에 기존에 사람들 번역해 논 거 그거 쪼끔 말씨만 그거 바꾸고 그래 가지고 책을 맨들어 가지고 지가 마치 창작하듯,gs,"When you look at it all, it's the old-fashioned translation that changes that, you know, it's the old-fashioned thing, and it's the old-fashioned thing, it's the old-fashioned thing, it's the old-fashioned thing, it's the old-fashioned thing, it's the old-fashioned thing, it's the old-fashioned thing, it's the old thing, the old-fashioned thing, it's the old-fashioned thing, you know, you're the one, you're the one, you're the one, you're the one, you're the one, you're the one, you're the one, you're the one, you're the one, you're the one, you're the one, you're the other, you're the one, you're the one, you're the one, you're the one, you're the one, you're the one, you're the one, you're the one, you're the one, you're the one, you're the one, you're the one, you're the one, you're the one, you're the one, you're the one, you're the one, you're the one, you're the one, you're the one, you're the one, you're the one, you're the one, you're the one, you're the one, you're the one, you're the one, you're the one, you're the one, you're the one, you're the one, you're the one, you're the one, you're the one, you're the one, you're the one, you're the one, you're the one, you're the one, you're the one, you're the one, you're the one, you're the one, you're the one, you're the one, you're the one, you're the one, you're the one, you're the one, you's the one, you're the one, you're the one, you're the one, you're the one, you're"," If you look at all of them, you can see that people have translated things in the past, only slightly change the wording, and then make a book with it and create it as if you were creating it yourself."
210003,너는 다이어트하고 있나?,니는 다이어트하고 있나?,gs,Are you dieting?, are you on a diet
134999,그거 넉 달 공부하더니만 떼 따주더라고 머리는 아주 좋아 내가 봐도,그거 넉 달 공부하디만 떼 따주더라고 머리는 대끼리 좋아 내가 봐도,gs,"I studied it for four months, and it only helped me through it, and my hair is very good, and I can see it."," I studied it for four months, but he picked it up, and I can see that he has a very good head."
131242,그냥 차나 적당한 거 하나 사서 뭐~ 뭐~,그냥 차나 적당한 거 하나 사가 뭐~ 뭐~,gs,Why don't you just buy me a car or something?, Just buy a car or something suitable and what~ what~
124616,마땅한 적임자가 없고 적임자를 찾는데 저 밑에 조금 짬이 낮은 애한테 시키려면 시켜야 되는데,마땅한 적임자가 없고 적임자를 찾는데 저 밑에 쫌 짬이 낮은 애한테 시키려면 시켜야 되는데,gs,"We need to find the right person, and we need to give it to a kid who's a little low down there."," There is no suitable person, and I am looking for the right person."
137145,시간이 너무 부족해 가지고 내 이미 지금 굳어가지고 다 말은 못 하는데,시간이 너무 부족해 갖고 내 이미 지금 굳어가지고 다 말은 못 하는데,gs,"I don't have enough time, and I'm already stuck, so I can't talk."," Time is too short, I'm already frozen now, I can't say everything"
126801,두 명 세 명 이렇게 가더라도 뭐~,두 명 세 명 이래 가더라도 뭐~,gs,"Two, three, you can go like this."," Even if two or three go like this, what"
210262,바 얼마 전에 제가 몇 년 전에 들었는데 짐 바뀌어가지고 어떻게 해서,바 얼마 전에 제가 몇 년 전에 들었는데 짐 바껴가지고 어떻게 해서,gs,"A few years ago, I heard that a few years ago."," A while ago, I heard about it a few years ago, but somehow it changed."
125222,어떻게 사람 팔자를 아노 그래 이왕 따는 거 일종 따지 뭐~ 하면서 일종을 신청했습니다.,어떻게 사람 팔자를 아노 그래 이왕 따는 거 일종 따지 뭐~ 카면서 일종을 신청했습니다.,gs,"How do you know a man's son? You know, you're kind of picking a king, and you're asking him to do something.",How do you know how to sell people?
140437,이런 식으로 막 이렇게 피해가고 했는데 조금 잠잠해지다가,이런 식으로 막 이케 피해가고 했는데 쫌 잠잠해지다가,gs,"I was running away like this, and then I got a little quiet."," I was just avoiding it like this, but it calmed down a bit"
135413,그리고 우리 나이에 먹으면 좋은 게 뭐냐면요.,그라고 우리 나이에 먹으면 좋은 게 뭐냐면예.,gs,And what's good is when we get to our age., And what is good to eat at our age?
127612,뭐~ 씻을까 이러면서 모텔 데리고 가서 씻기던가 아니면 집에 들어가서,뭐~ 씻을까 이러면서 모텔 데꼬 가서 씻기던가 아니면 집에 들어가서,gs,"You can take a motel and wash it, or you can go home."," I was thinking, “Should I wash up?” I took him to the motel and washed up, or I went home."
143617,그러니까 내가 키우는 거지 내 친구는,그러께네 내가 키우는 거지 내 친구는,gs,That's why I'm raising him. My friend., That's why I'm raising my friend
138337,나 @이름1이랑 @이름이랑 울산 갔었는데,내 @이름1이랑 @이름이랑 울산 갔었는데,gs,I went to @1 and i went to Ulsan., I went to Ulsan with @name1 and @name
134167,아~ 조금 쪼끔 지치는 일이긴 하죠 이게,아~ 쫌 쪼끔 지치는 일이긴 하죠 이게,gs,It's a little boring.," Ah~ It's a bit tiring, but this"
132162,그 전에 업무를 할 때는 되게 전화가 엄청 많이 받는 업무였거든.,그 전에 업무를 할 때는 디게 전화가 엄청 많이 받는 업무였거든.,gs,"Before that, when I was working, I was getting a lot of phone calls."," Before that, when I was working, it was a job where I received a lot of calls."
137409,인생교훈처럼 조금 얻는 게 어릴 때 이제,인생교훈처럼 쫌 얻는 게 어릴 때 이제,gs,"When I was a kid, a little bit of learning in life."," Like a life lesson, getting a little is now when you're young"
140990,그래서 내려왔다는 거 아니냐?,그래가 내려왔다는 거 아이가?,gs,Isn't that why you came down?, Is that why you came down?
131253,주었니 하면서 아무거나 다 먹고,줬나 하면서 아무거나 다 먹고,gs,You gave it to me. You ate everything.," Saying that you gave me something, I ate everything"
138076,쪼 그게 너무 아쉬웠어요 차라리 이렇게 조금,쪼 그게 너무 아쉬웠어요 차라리 이케 쫌,gs,"Oh, that was too bad. I'd rather be a little like this.", I was so sorry about that. I'd rather be like this a little bit
211558,그래서 요샌 조금 안 먹고 있다 근데 그것도 나름 맛있더라.,그래서 요샌 쫌 안 먹고 있다 근데 그것도 나름 맛있더라.,gs,"So I'm not eating a little, but it's delicious."," So I don't eat a little bit these days, but it was delicious as well."
129780,맡기고 갔는데 그 뒤로 절대 안 찾아가가지고 언니가 계속 키우게 됐단 말이야 그래서 약간 그렇게 해서 키우게 된 경우가 많은 것 같다 조금,맡기고 갔는데 그 뒤로 절대 안 찾아가가지고 언니가 계속 키우게 됐단 말이야 그래서 약간 그렇게 해서 키우게 된 경우가 많은 것 같다 쫌,gs,"I've been away, and I've never come back, and I've been raised by my sister, so it's a little bit like that."," left it there, but after that, I never went back and my sister kept raising it."
128413,사실 명품 가방을 하나 안 살 수가 없어요 조금 약간,사실 명품 가방을 하나 안 살 수가 없어요 쫌 약간,gs,"Actually, I can't afford a bag of luxury. A little bit."," Actually, I can't afford not to buy a luxury bag. A little bit"
139413,예전에는 그렇고 흔한 그러니까 이렇게 많이 사람들이 소비하는,예전에는 그렇고 흔한 그까 이렇게 많이 사람들이 소비하는,gs,"In the past, it's very common."," In the past, it was common, so this much people consume"
134543,태풍이 조금 많이 올라오는 거 같기는 한데 뭐~,태풍이 쫌 많이 올라오는 거 같기는 한데 뭐~,gs,I think there's a lot of typhoons coming up.," It seems like a typhoon is coming up a little bit, but what~"
137531,거기도 그렇지?,거기도 그렇제?,gs,"That's it, too, isn't it?", Is it there too?
143103,살생부라고 해서 이렇게 큰,살생부라고 해서 이케 큰,gs,He's a killer. He's so big.," It's called the killing department, so it's so big"
126866,저거를 저래 지킬 정도면 대단하다.,쩌거를 저래 지킬 정도면 대단하다.,gs,It's great to keep it that way., It's great to keep that thing like that.
128015,서로가 이렇게 애들한테 쏟아지는 시간도 많이 투자를 해야 될 거고 하니까,서로가 이르케 애들한테 쏟아지는 시간도 많이 투자를 해야 될 거고 하니까,gs,We're gonna have to invest a lot of time in each other's kids., They say that we need to invest a lot of time that each other spends on our kids like this.
134120,조금 티엠아이였나?,쫌 티엠아이였나?,gs,A little Timothy?, Was it a little TMI?
126648,일 층에 미용실 그때 형 그러니까 그 형님 미용실 할 땐데 일 층 가 머리 잘라 ,일 층에 미용실 그때 형 그니까 그 형님 미용실 할 땐데 일 층 가 머리 잘라 ,gs,"That's when he's in the hair salon on the first floor, so let's cut his hair on the first floor."," Hair salon on the 1st floor Back then, when he was at the hair salon, he went to the 1st floor and got his hair cut."
124728,멋있어 보이더라고요 되게  자기 스타일을 조금 잘 아는 사람이구나 딱 느껴지는 게 그런 거 같애요 그냥 음~ 평범하게 약간,멋있어 보이더라고요 되게  자기 스타일을 쫌 잘 아는 사람이구나 딱 느껴지는 게 그런 거 같애요 그냥 음~ 평범하게 약간,gs,"I think that's what it feels like, but it's just, you know, it's just, it's just, it's just, you know, it's just, it's just, it's just, you know, it's just, it's just, you know, it's just, it's just, you know, it's just, it's just, you know, it's just, it's just, it's just, you know, it's just, you know, it's a little, it's a little, it's a little, it's a little, it's a little, it's a little, it's a little, um, it's a little, it's a little, it's a little, it's kind of a little, it's a little, it's a little, it's a little, it's a little bit of a little bit of a little bit of a little bit of a little bit of a little bit of a little bit of a little bit of a little bit of a little bit of a little bit of a little bit of a little bit of a little bit of a little bit of a little bit of a thing of a little bit of a little bit of a thing of a thing of a thing of a thing of a thing of a thing of a thing of a thing of a thing of a thing of a thing of a thing of a thing of a thing of a thing of a thing of a thing of a thing of a thing of a thing of a thing of a thing of a thing of a thing of a thing of a thing of a thing of a thing of a thing of a thing of a thing of a thing of a thing of a part of a thing of a thing of a thing of a thing of a thing of a thing of a thing of a thing of a thing of a thing of a thing of a thing of a thing of a thing of a thing of a thing of a thing of a thing of a thing of a thing of a thing of a thing of a thing of a thing of a thing of a thing of a thing of a thing of a thing of a thing of a thing of a thing of a thing of a thing of a thing of a thing of a thing of a thing of a thing of a thing of a thing", You look cool. You're a person who knows your style a little bit well. I think that's what it feels like.
124668,조금 장기간을 계속하고 있는 거는 어~ 그~ 요가하고,쫌 장기간을 계속하고 있는 거는 어~ 그~ 요가하고,gs,It's been going on for a long time.,What I've been doing for a little while is uh~ that~ yoga
125447,엄마가 이제 돈 관리를 해 주게 된 거야.,엄마가 안자 돈 관리를 해 주게 된 거야.,gs,She's the one who's been managing the money now., My mom is now taking care of the money.
143000,일제가 한국을 식민지로 만들었다,일제가 한국을 식민지로 만들었따,gs,I've colonized Korea., Japan colonized Korea
136091,그게 조금 그냥 한 번씩 하기니까 되게 재밌더라구요 저도 그래서 그거를 조금 주로 하고 있고,그게 쫌 그냥 한 번씩 하기니까 되게 재밌더라구요 저도 그래서 그거를 쫌 주로 하고 있고,gs,"It's just a little funny because it's a little bit of a one-time thing, and I'm doing it a little bit, and I'm doing it a little bit of a little bit.", It's really fun because I only do it once in a while. That's why I'm doing it mostly
129620,다른 쪽으로 하고 싶으면은 내 자신에 대한 투자가 가장 큰 그거라고 생각하기 때문에 그 얘기를 잠깐 조금 해보고 싶었었고,따른 쪽으로 하고 싶으면은 내 자신에 대한 투자가 가장 큰 그거라고 생각하기 때문에 그 얘기를 잠깐 쫌 해보고 싶었었고,gs,"If I wanted to do it the other way, I wanted to talk a little bit about it because I thought my investment in myself was the biggest one."," If you want to do it the other way, I think investing in yourself is the biggest thing, so I wanted to talk about it for a while."
128548,그 이후에 이제 조금,그 이후에 이제 쫌,gs,"After that, a little bit.", a little bit after that
132868,그러니까 뭔가 다리가 무릎이랑 엄청 아픈 거예요 원래 이 정도 일한다고 막 아프지가 않은데,그니까 뭔가 다리가 무릎이랑 엄청 아픈 거예요 원래 이 정도 일한다고 막 아프지가 않은데,gs,"That's why my leg hurts so much with my knee, and it doesn't hurt because I work this much."," So, something hurts my legs and knees a lot."
208433,놀기도 잘 놀고 얼마나 싸돌아다니는 그럼 언니 고기는 뭐뭐 하는데 산적도 해?,놀기도 잘 놀고 얼마나 싸돌아다니는 그럼 언니 고기는 뭐뭐 하는데 산적도 하나?,gs,What are you doing with your meat?," You play well, and how much you wander around. So what do you do with your sister's meat, and do you buy it?"
207820,그~ 영화도 보고 싶고 그냥 그~ 그랬으면 좋겠다 그리고,그~ 영화도 보고 싶고 걍 그~ 그랬으면 좋겠다 그리고,gs,"I want to see a movie, I want to see a movie, and I want it to be that way."," I want to see that~ movie, and I just wish that~"
127625,옷이 비에 조금 젖어 있고 학교에 가면 인제 뭐~,옷이 비에 쫌 젖어 있고 학교에 가면 인제 뭐~,gs,"It's a little wet, so if you go to school, it's fine."," My clothes are a little wet from the rain, and when I go to school, what am I going to do?"
136893,돈을 빌리고 하니까 친구들한테 신용도도 괜히 조금 떨어지는 것 같고 돈을 용돈을 받아도 그걸 다 친구들 줘야 되니까 어떻게 보면 조삼모사인 셈이잖아요 그래서 저는,돈을 빌리고 하니까 친구들한테 신용도도 괜히 쫌 떨어지는 것 같고 돈을 용돈을 받아도 그걸 다 친구들 줘야 되니까 어떻게 보면 조삼모사인 셈이잖아요 그래서 저는,gs,"It's like I'm borrowing money, and it's just a little bit of a credit drop for my friends, and I'm going to give them all my friends, so it's kind of like a Sam-Sam-Sam-Sam-Sam-Sam-Sam-Sam-Sa.","Since I borrowed money, my credit rating from my friends seems to be a bit low for no reason."
