,text,dial,reg,eng,intent
210875,왜냐면 위험하니까 이게 조금 장난기 많은 동기들이나 만약에 자대를 받 배치를 받더라도,왜냐면 위험하니까 이게 쫌 장난기 많은 동기들이나 만약에 자대를 받 배치를 받더라도,cc,"Because it's dangerous, and it's a little bit of a joke, or even if you're given a hand-me-down."," Because it's dangerous, even if this is a bit playful motive"
100946,이거는 어~ 이~ 병이 유발되는 확률이 적고 얘는 조금 있으니까 서포트를 해 줘서 발병이 되더라두,이거는 어~ 이~ 병이 유발되는 확률이 적고 얘는 쫌 있으니까 서포트를 해 줘서 발병이 되더라두,cc,"This one's less likely to cause a disease, and he's got a little bit of this, so he's doing a job and he's got it.", This uh~ uh~ There is little chance of getting sick
122970,조금 인플루언서 그런 사람들은 이런 거 막 그냥 협찬도 받는단 말이야.,쫌 인플루언서 그런 사람들은 이런 거 막 그냥 협찬도 받는단 말이야.,cc,"It's a little inflammable, so they just get a lot of money for this.", Those who are a bit of an influencer just get sponsored for this kind of thing.
104863,뿌리는게 쉽지 편하고 그리고 뿌리는 거는 이렇게 좀 맛이 나 왜,뿌리는게 쉽지 편하고 그리고 뿌리는 거는 이렇게 쫌 맛이 나 왜,cc,It's easy to sow and it's a little bit of a taste.," It's easy and convenient to sprinkle, and it tastes a bit like this, why?"
119798,그리고 이제 나중에 드라이브를 가서 해보고 싶은 게,그러고 이제 나중에 드라이브를 가서 해보고 싶은 게,cc,And now I want to go back to the drive later., And now I want to go for a drive later
105774,나는 당장이라도 실천해야 될 거 같은 욕구가 뿜뿜하고 있어요.,나는 당장이라도 실천해야 될 거 같은 욕구가 뿜뿜하고 있슈.,cc,I have a desire to do it right now., I have a desire to act right now.
115742,나는 좀 뭔가 처음부터 잘하고 싶은 마음은 강했는데,나는 쫌 뭔가 처음부터 잘하고 싶은 마음은 강했는데,cc,I had a strong desire to do something right from the start., I had a strong desire to do something well from the beginning.
99682,홀애비인가 세상에 그렇게 드러갖고 무슨 뭐~ 그 운전을 하고 다녀.,홀애비인가 세상에 그렇게 드러갖고 무슨 뭐~ 그 운전을 하고 댕겨.,cc,"It's like she's in the world, and she's driving like that.", Are you a single parent or do you expose yourself to the world like that and drive around like that?
100108,근데 이게 세균성이면 문제가 있는 거래요 그러니까 우리가 이게 만약에 유산균을 많이 먹으면  그런 건가 봐요.,근데 이게 세균성이면 문제가 있는 거래요 그니까 우리가 이게 만약에 유산균을 많이 먹으면  그런 건가 봐요.,cc,"But if it's bacterial, it's a problem, so maybe if we eat a lot of it, it's like that.","But if it's bacterial, there's a problem. So, if we eat a lot of lactic acid bacteria, it must be like that."
107195,조금 해보려구 하는 거 같아.,쫌 해보려구 하는 거 같어.,cc,I think I'm trying to do a little bit., I think I'm going to try a little bit.
110110,이제 조금 찾으러 다니셨대요.,이제 쫌 찾으러 다니셨대요.,cc,He's been looking for a little bit now., Now you've been looking for a little bit.
109380,근데 사실 뭐~ 까페 창업 진짜 하고 싶은 꿈이고 공무원도 요즘 들어서 그러니까,근데 사실 뭐~ 까페 창업 진짜 하고 싶은 꿈이고 공무원도 요즘 들어서 그니까,cc,"But actually, it's a dream that I really want to do, and government officials have been doing it lately."," But actually, it's a dream that I really want to start a cafe, and the public servants have also heard these days."
115718,어 그냥 이렇게 물회 먹고가자 그러는데 별로 먹고 싶은 생각이 없어 그때 당시에는 막,어 그냥 이케 물회 먹고가자 그러는데 별로 먹고 싶은 생각이 없어 그때 당시에는 막,cc,"Uh, I'm just going to have a drink like this, but I don't really want to eat at the time."," Uh, let’s just eat raw fish like this and go, but I didn’t really want to eat it. At that time, I just"
103729,내가 아니 우리도 이제까지 계속 기다렸고 다른 사람들도 다 그 정도 찍는데 계속 나 조금 찍어주고 어~ @이름빨리 나와 -이- 이러면서 사람 기다린다고,내가 아니 우리도 이제까지 계속 기다렸고 다른 사람들도 다 그 정도 찍는데 계속 나 쪼꼼 찍어주고 어~ @이름빨리 나와 -이- 이러면서 사람 기다린다고,cc,"I mean, we've been waiting so long, and everyone else has been filming me a little bit, and we've got to get a name for it."," I didn't, we've been waiting until now, and everyone else took pictures like that, so they kept taking pictures of me."
102488,그러니까 하나님을 믿으면서 이렇게 삼위일체 설을 믿는 거잖아요 성부 성좌 성령을 믿는 거잖아요.,그까 하나님을 믿으면서 이케 삼위일체 설을 믿는 거잖아요 성부 성좌 성령을 믿는 거잖아요.,cc,"So you believe in God, and you believe in the Trinity, and you believe in the Holy Ghost."," So while you believe in God, you believe in the Trinity theory, right? You believe in the Holy Spirit, the constellation of the Father."
100679,이게 어떻게 굽느냐에 따라 맛이 다르잖아?,이게 어떻게 꿉느냐에 따라 맛이 다르잖아?,cc,It tastes different depending on how this is baked., Doesn't it taste different depending on how you bake it?
119089,아주 너무 이게 강한 거야 아우 그래 가지고 무슨 대화할 때마다 섬짓 섬짓한 거 있잖아 그러니까,아주 너무 이게 강한 거야 아우 그래 가주구 무슨 대화할 때마다 섬짓 섬짓한 거 있잖아 그니까,cc,"You know, every time you talk to her, you make an island."," This is very, very strong."
109054,아 난 우리 엄마 얼굴 보고 내가 깜짝 놀랐거든 그러니까 완전 다 없어졌어 아 엄마 보니까 나도 하고 싶은 거야.,아 난 우리 엄마 얼굴 보고 내가 깜짝 놀랐거든 긍까 완전 다 없어졌어 아 엄마 보니까 나도 하고 싶은 거야.,cc,"Oh, I was so surprised by my mom's face, so it's all gone, you know, it's what I want to do.","Ah, I was shocked when I saw my mother's face, so it's completely gone."
122894,야 그러면 너희는 입양에 대해 혹시 어떻게 생각해?,야 그러면 니네는 입양에 대해 혹시 어떻게 생각해?,cc,"So, what do you think about adoption?"," Hey then, what do you guys think about adoption?"
120432,그래도 뿌듯함도 많이 남았던 알바였던 것 같아.,그래도 뿌듯함도 많이 남았던 알바였던 것 가텨.,cc,I guess it was a little bit of a pride left over.," Still, I think it was a part-time job that left a lot of pride behind."
111428,저는 노란색을 조금 좋아해서 노란색 보라색 같은 이미지로 남아있어요.,저는 노란색을 쫌 좋아해서 노란색 보라색 같은 이미지로 남아있어요.,cc,"I like yellow a little bit, so I'm left with this yellow purple image."," I like yellow a little, so it remains as a yellow-purple image."
122500,장래 희망이 계속 바뀔 때거나 아니면 조금 고민이 될 때,장래 희망이 계속 바뀔 때거나 아니면 쫌 고민이 될 때,cc,"When hope for the future changes, or when there's a little bit of anxiety,", When your hopes for the future keep changing or when you are a little worried
99943,못 즐겨서 조금 아쉽긴 한데요 가을에 산책하거나  사진 찍으러,못 즐겨서 쫌 아쉽긴 한데요 가을에 산책하거나  사진 찍으러,cc,"It's a little sad that I don't like it, but I'm gonna take a walk in the fall or take a picture."," It's a bit unfortunate that I couldn't enjoy it, but I went for a walk or took pictures in the fall"
118511,그러니까 보고 나면은 뭔가 내 안에서 약간 분노라든지 그거에 공포라든지,그니까 보고 나면은 뭔가 내 안에서 약간 분노라든지 그거에 공포라든지,cc,"So when you see it, there's something inside of you that's a little bit of anger, a little bit of fear, a little bit of fear."," So, after seeing it, there is a little bit of anger inside me or fear about it"
118951,그러면 정말로 여름이 지나가고 끝났다는 그~ 느낌이 조금 있어요.,그러면 정말로 여름이 지나가고 끝났다는 그~ 느낌이 쫌 있어요.,cc,And I really have a feeling that summer is over and it's over., Then there is a little bit of that feeling that summer has really passed and ended.
119320,결국에는 프로 프로 그러니까 포스트모더니즘 나온 그~ 계기가 자체가 전쟁이 끝난 이후에,결국에는 프로 프로 그까 포스트모더니즘 나온 그~ 계기가 자체가 전쟁이 끝난 이후에,cc,"In the end, the pro pro-pro, the post-immunism thing is that after the war was over,"," In the end, the pro pro, so the postmodernism came out after the war itself."
107608,손이 텄는데도 구슬치기하면은 이렇게 던져가지고,손이 텄는데도 구슬치기하면은 이케 던져가지고,cc,"If you have a hand, but if you have a hand, you'll throw it like this."," Even though my hand is open, when I play marbles, I throw it like this"
116041,저는 요새 조금 그렇게 구매를 하고 있는데 혹시 요새 쇼핑이,저는 요새 쫌 그렇게 구매를 하고 있는데 혹시 요새 쇼핑이,cc,I've been buying it a little bit lately.,"I'm buying a little like that these days, but if you're shopping these days"
106743,내 친구 디자이너 많거든 그러니까 디자이너라기 보다는 한 명은 서울에서 디자인을 하고 있고 한 명은,내 친구 디자이너 많거든 그니까 디자이너라기 보다는 한 명은 서울에서 디자인을 하고 있고 한 명은,cc,"I have a lot of friends of designers, so instead of being a designer, one of them is designing in Seoul, and one of them is designing in Seoul."," I have many designers, so rather than designers, one is designing in Seoul and the other is"
114645,그래서 걷는 거를 되게 좋아해가지구 남들보다 조금 오래 걷고 많이 걷고,그래서 걷는 거를 되게 좋아해가지구 남들보다 쫌 오래 걷고 많이 걷고,cc,"So I love walking, and I walk a little longer than the rest of the world, and I walk a lot more than the rest of the world.", That's why I really like walking. I walk a little longer than others and walk a lot.
120040,아 이게 내가 이제 아 이거 괜찮네 그럼 요거에 대해서 왜 사람이 딱 옷을 한 번 딱 맞닿드리고 나면은 막 옷만 사지고,아 이게 내가 인저 아 이거 괜찮네 그럼 요거에 대해서 왜 사람이 딱 옷을 한 번 딱 맞닿드리고 나면은 막 옷만 사지고,cc,"Oh, this is good for me."," Ah, this is me now. Ah, this is fine. Then, about this, why do people just buy clothes after touching them exactly once?"
118735,그런데 딱 겉에서 봤을 때,그른데 딱 겉에서 봤을 때,cc,"But from the outside,"," However, when viewed from the outside"
109424,그냥 화장시켜서 그냥 이렇게 어디다 그냥 띄우라고 내가 이래 그냥,그냥 화장시켜서 그냥 이케 어디다 그냥 띄우라고 내가 이래 그냥,cc,Let's just get her cremated and let's just get her out of here., Just make it up and just put it on somewhere like this I just say this
112427,이제 근데 작년에 그때 박물관에서 알바를 했었는데 접때 그 뭐야,인자 근디 작년에 그띠 박물관에서 알바를 했었는디 접때 그 뭐여,cc,"Now, last year, I was doing a job at the museum."," Now, but last year, I worked part-time at the museum, but what was that at the time?"
107277,그리고 또 직원들한테도 잘한다고 하대,그러고 또 직원들한테도 잘한다고 하대,cc,And he says he's good to his employees., And he says he's good to his employees
117920,근데 연하나 동갑은 일단 동갑이랑 사귀었을 때 되게 안 좋은 추억이 있어서 동갑이 꺼려지는 경우도 있지만,근데 연하나 동갑은 일단 동갑이랑 사겼을 때 되게 안 좋은 추억이 있어서 동갑이 꺼려지는 경우도 있지만,cc,"But, you know, once you're with your brother, you have some very bad memories, and you don't like your brother's age."," However, there are cases where people of the same age are reluctant to be of the same age because they have very bad memories when dating someone of the same age."
111137,그러니까 자 완전 못하지는 않는데,그니까 자 완전 못하지는 않는데,cc,So it's not a complete mistake.," So, I'm not really good at it."
111341,영상적인 측면에서 조금 확실히 많이 좀 떨어지는 게 있는 거 같애요 저는 사실,영상적인 측면에서 쫌 확실히 많이 좀 떨어지는 게 있는 거 같애요 저는 사실,cc,I think there's a little bit of a drop in the video.,"In terms of visuals, there seems to be a little bit of a bit of a bit of a bit of a bit of a bit of a bit of"
115968,크로스핏이 아무래도 조금 근지구력운동이랑 같이 섞여있으니까,크로스핏이 아무래도 쫌 근지구력운동이랑 같이 섞여있으니까,cc,It's probably a little bit of a modern movement., Because CrossFit is mixed with a little muscular endurance exercise.
120953,마음을 치유하는 건 아니여도 뭔가 노래를 들으면 좀 힘이 나는것 같아.,마음을 치유하는 건 아니여도 뭔가 노래를 들으면 좀 힘이 나는것 같여.,cc,"It's not about healing the heart, but it's about to give me some strength to listen to something."," Even if it doesn't heal the mind, I think it gives me strength when I listen to something."
113899,너무 좋아가지고 이제 조금 기억에 오래오래 남는 말인데 아무튼,너무 좋아가지고 이제 쫌 기억에 오래오래 남는 말인데 아무튼,cc,"It's been a long time since I was so fond of it, anyway."," I like it so much that it's a word that will stay in my memory for a long time now, anyway."
112260,두 시간을 @웃음 두 시간을 인제 그~ 그거를 이제,두 시간을 @웃음 두 시간을 인제 그~ 그거를 인자,cc,"Two hours, @laugh, two hours, and that's what I'm talking about.", Two hours @Laughter Two hours now that~ that now
106995,공무원이 최고다 그냥 돈 조금 벌어도 안정적이고 평생 가지 않느냐 그러니까,공무원이 최고다 그냥 돈 조금 벌어도 안정적이고 평생 가지 않느냐 그니까,cc,"Just make a little bit of money, and it's gonna be safe and it's gonna last forever."," Civil servants are the best. Even if you just earn a little money, it will be stable and will last a lifetime."
112296,그러니까 목 디스크가 약간 있으셔서 그게 그거 빼고는 건강하신 편이에요 그래서,그까 목 디스크가 약간 있으셔서 그게 그거 빼고는 건강하신 편이에요 그래서,cc,"So you have some neck disk, which means you're healthy, except for that."," So, you have a bit of a herniated disc in your neck, so other than that, you're pretty healthy."
123136,막 엄정화랑 화사랑 제시 이렇게 해서 넷이 한다고 막 그랬었는데 그게 반응이 좋았던 거야.,막 엄정화랑 화사랑 제시 이렇게 해서 넷이 한다고 막 그랬었는디 그게 반응이 좋았던 겨.,cc,"I just told him that I had four of them doing this, and that was a good reaction."," Uhm Jung-hwa and Hwa-sarang and Jessi were doing it like this, so the four of them did it, but that was a good response."
116396,그래서 인제 나만의 그~ 구절판을 좀 해보려고 지금 머릿속에 지금 상상을 하고 있는데,그래서 인제 나만의 그~ 구절판을 좀 해볼려고 지금 머릿속에 지금 상상을 하고 있는데,cc,"So I'm just trying to do some of my own readings right now, and I'm just trying to figure out what to do.", So now I'm imagining it in my head to try my own version of that~ phrase.
107785,예전에는 블로그를 한창 많이 해서 파워 블로거까지 했었어요.,예전에는 블로그를 한참 많이 해서 파워 블로거까지 했었어요.,cc,I used to have a lot of blogs and Power Blogs.,"In the past, I blogged a lot, so I even became a power blogger."
106084,하다 보니까 마음을 내려놓으신 거 같드라구요 지금은 진짜 하나 하나 집어서 음식에 대해서 얘기해주시고,하다 보니까 마음을 내려놓으신 거 같드라구요 지금은 진짜 하나 하나 찝어서 음식에 대해서 얘기해주시고,cc,"Now that you've got one real thing, you've got to talk to me about food, and you've got to talk to me about food, and you've got to talk to me about food, and you've got to talk to me about food, and you've got to talk to me about food, and you've got to talk to me about food, and you've got to talk to me about food."," It seems like you've put your mind down. Now, pick them up one by one and talk about food."
107958,알고 보니까 동갑인 거야 그래 동갑이어서 어 얘기하다가 그럼 우리 반말 할까,알고 보니까 동갑인 겨 그래 동갑이어서 어 얘기하다가 그럼 우리 반말 할까,cc,"It turns out he's your age, and he's your age, so we'll talk about it, and then we'll talk about it."," It turns out that we are the same age. Yes, we are the same age."
103510,네가 지금 당장 약간 실현할 수 있는 계획이 있어?,너가 지금 당장 약간 실현할 수 있는 계획이 있어?,cc,Do you have a plan that you can do a little bit right now?, Do you have any plans that you can realize right now?
208252,그러구 나서 조금 괜찮은가 했더니,그러구 나서 쫌 괜찮은가 했더니,cc,"And then I said, ""Is everything okay?"""," After that, I wondered if I was okay"
103118,날 이렇게 생각 안 하나 이런 생각한거 그러니까그게 근데 정이 많다는 게 그것도 성격인가?,날 이렇게 생각 안 하나 이런 생각한거 긍까그게 근데 정이 많다는 게 그것도 성격인가?,cc,"You don't think of me like this, but is it personality that you're compassionate about?", Don't you think of me like this?
121715,바깥에서는 얼마나 까다로워.,바깥에서는 얼마나 까다롭시려.,cc,It's so tough out there., How tricky is it outside.
123437,나는 거기다 널르 넣느니 그냥 위에다 놓고,나는 거기다 널르 넣느니 그냥 우에다 놓고,cc,"I don't put it in there, I just put it on top."," Rather than putting you in there, I just put it on top"
210796,등 그런 뭔가 신기한 노래들이잖아 그래 갖고 그~ 노래를 듣다가 정진영이라는 그,등 그런 뭔가 신기한 노래들이잖아 그래 가주구 그~ 노래를 듣다가 정진영이라는 그,cc,"Yeah, and then you listen to him, and then you hear him, and then you hear him, and then you hear him, and you hear him.", Those are some strange songs.
115697,그 건강에 조금 건강 그 영양제에 관심을 많이 갖고 있거든요.,그 건강에 쫌 건강 그 영양제에 관심을 많이 갖고 있거든요.,cc,I'm a little bit interested in that health diet., I have a lot of interest in that health supplement.
117561,그러면서 헷갈 그러니까 다른 형부들은 헷갈린다 그랬거든 사람 워낙 많아서,그러면서 헷갈 그까 다른 형부들은 헷갈린다 그랬거든 사람 워낙 많아서,cc,"And it's confusing, because the other brothers are confused, because there's so many people."," And then they get confused, that's why they said other brothers get confused"
117494,받으면 자기들도 해야 되잖아.,받으므는 자기들도 해야 되잖아.,cc,"If they get it, they have to do it.","If you get it, you have to do it too."
121371,술을 많이 잡쉈고 그 엄마가 고생을 했지 아버지가 그러니까,술을 많이 잡쉈고 그 엄마가 고생을 했지 아부지가 그러니까,cc,"She's been drinking a lot, and she's been through a lot."," I drank a lot, and my mother had a hard time, so my father"
204930,그리고 나는 너희랑 좀 다르게 나는,그리고 나는 너네랑 쫌 다르게 나는,cc,And I'm not like you guys., And I'm a little different from you
114690,그래서 아휴 안타까움도 있지 날씨는 추울 땐 추워야된다고 하더라고,그래서 아휴 안타까움도 있지 날씨는 추울 땐 추워야된다고 하드라고,cc,He said we should be cold in the cold.," So ahh, there is also a sense of pity. They say that when the weather is cold, it should be cold."
107905,아~우리는 형제끼리는 싸우고 한 적이 없는데 그런 걸로 싸우는 거 같애 이렇게 가만히 보면 이렇게 말씨름을 하더라고,아~우리는 형제끼리는 싸우고 한 적이 없는데 그런 걸로 싸우는 거 같애 이렇게 가만히 보면 이렇게 말씨름을 하드라구,cc,"We've never been fighting between brothers, but I think we're fighting with that kind of thing."," Ah~ We've never had a fight with each other, but it seems like we're fighting over something like that."
102489,다음 제품 때까지 조금 기다렸다가 살 예정입니다 아이폰은 파이브지 여부도,다음 제품 때까지 쫌 기다렸다가 살 예정입니다 아이폰은 파이브지 여부도,cc,"We're going to wait for the next product, and then we're going to live on it.", I'm going to wait a little bit until the next product and buy it.
118782,그렇지 풍천 장어 왜 알아주는지 알겠더라.,그렇지 풍천 장어 왜 알아주는지 알겠드라.,cc,"Yeah, I know why you recognize the satire."," That's right, I understand why Pungcheon eel is known."
111439,그래서 오히려 실용성을 생각하게 되고 노멀한 스타일을 찾게 되고 조금 더,그래서 오히려 실용성을 생각하게 되고 노멀한 스타일을 찾게 되고 쫌 더,cc,"So you start to think about practicality, and you start to find the old style, and you start to get a little bit more useful."," So rather, I think about practicality and find a normal style, and a little more"
122576,결말이 허무 했던거 허무 수준까지는 아니었는데 내가 원하는,결말이 허무 했던거 허무 수준까지는 아니었는디 내가 원하는,cc,"It wasn't what it was, it wasn't what it was, it wasn't what I wanted it to be."," The ending was futile, but it wasn't to the level of futility, but what I wanted"
104314,음~ 오후에는 이제 부식따라 저는 조금 옮겨다녔거든요 그리고,음~ 오후에는 이제 부식따라 저는 쫌 옮겨다녔거든요 그리고,cc,"Well, in the afternoon, after the decay, I moved around a little bit."," Um~ In the afternoon, I moved a little bit along with corrosion. And"
103145,저기 저기 한참 들판에 나가면 깨끗한 저수지 이렇게 물 나오는 데가 있어,저기 저기 한참 들판에 나가믄 깨끗한 저수지 이케 물 나오는 데가 있어,cc,There's this clean reservoir that comes out of that field over there.," If you go out to the field for a while, there is a place where water comes out like a clean reservoir"
111172,되게 약간 걱정을 조금 많이 하셔가지구,되게 약간 걱정을 쫌 많이 하셔가지구,cc,He's a little bit worried.,You worry a little bit a little too much
116626,저거 해야 하는데 응 나 집에 볼 일이 있어서 가야 돼,저거 해야 하는데 응 나 집에 볼 일이 있어서 가야 되야,cc,"I have to do that. Yeah, I have work to do at home."," I have to do that, but I have something to do at home, so I have to go."
123246,조금 뭐 뭐라고 해야 되나 그때는 막 어수선한 느낌,쪼꼼 뭐 뭐라고 해야 되나 그때는 막 어수선한 느낌,cc,I don't know what to say., What should I say? It was a mess at that time
115041,그게 한 이억 쪼끔 안 나온 이억 이억 조금 넘어.,그게 한 이억 쪼끔 안 나온 이억 이억 쫌 넘어.,cc,That's a little more than two billion dollars worth of money.," It's a little over two hundred million, two hundred million."
121071,그때는 뭐~ 사실 종교를 갖는다라는 개념에 그런 개념을 갖고 이렇게,그때는 뭐~ 사실 종교를 갖는다라는 개념에 그런 개념을 갖고 이케,cc,"And that's when, in fact, the idea of being a religious person, and that's when I started to think about it."," At that time, well~ In fact, with that concept in the concept of having a religion,"
111996,부릉 잡아 땡기니까 진짜 오토바이가 나르더라고 붕 이렇게 뒷바 아 저 앞바퀴가 뜨니까 붕 날라.,부릉 잡아 땡기니까 진짜 오토바이가 날르드라고 붕 이케 뒷바 아 저 앞바퀴가 뜨니까 붕 날라.,cc,"I've got a real bike coming up, and it's like, ""Oh, my God, it's the front wheel that's blowing."""," Because I was craving for a vroom, a real motorcycle could be carried."
100275,어~ 무슨 캔커피를 조금 다른 커피를 줬던 거 같애요 그거랑,어~ 무슨 캔커피를 쫌 다른 커피를 줬던 거 같애요 그거랑,cc,"Uh, I think he gave me a little different coffee for some canned coffee.", Uh~ I think they gave me some kind of canned coffee with a slightly different coffee.
