,text,dial,reg,eng,intent
262799,장판 까는 거 있어,장판 까는 거 인,jj,Do you have anything to peel the floor, I have a mat
200003,그런데 사람이랑 사람이 만났는데,겐디 사람이랑 사람이 만나신디,jj,But then I met someone., But I met a person and a person
157409,벌레들 생기고 막 하니깐 그래서 해서 걔네도 오리를 키우는데,벌레들 생기고 막 하니깐 겡 행 걔네도 오리를 키우는디,jj,"They have bugs and they don't, which is why they raise ducks."," Since there are bugs, they just do it, so they raise ducks too."
167222,파는 줄 알아서 이렇게 왔다고 하면서,파는 줄 알앙 영 왔댄 하멍,jj,I thought you were selling. You said you were here., Saying that you came here knowing that you were selling
188608,누구예요 하고,누게꽝 허고,jj,Who are you?, who are you
291764,냉동실에 꺼내서 한 번 가져간 사람이 있어 그러니까,냉동실에 꺼냉 한 번 가져간 사람이 있어 게난,jj,"Someone got it out of the freezer and took it once, so..."," There's someone who took it out of the freezer and took it once, so"
228582,막아 버렸어,막아 부런,jj,I bstopped it, blocked it
198961,블로그 개설한지 얼마나 됬어?,블로그 개설한지 얼마나 된?,jj,How long have you been blogging?, How long has it been since you started your blog?
164308,아 동방신기 카시오페아가 무슨 말?,아 동방신기 카시오페아가 뭔 말?,jj,What do you mean?," Ah, what did TVXQ Cassiopeia say?"
328796,참말로 #이 저렇게 하면서 강아지를 키워야 될건가,참말로 이 저추룩 허멍으네 강생이를 키워야 될건가,jj,I don't know if he's gonna have to raise a puppy like that., Do you really have to raise a puppy while doing this?
168169,#게 나도 사라오름은 올해는 안 가봤으니까 올해 한번 가 보자.,게 나도 사라오름은 올해는 안 가봐시난 올해 한번 가 보쥬게.,jj,"# I haven't been to Sarah Orm this year, so let's go this year.","#I also haven't been to Saraoreum this year, so let's go this year."
331940,전부다 발로 뛰던데 와가지고 무슨일 생겼어요 하면서,전부다 발로 뛰던디 와가지고 무슨일 생겼어요 하면서,jj,They're all running on their feet. They're all here. They're saying something happened.," Everyone was running on their feet, but they came and said something happened"
230643,그런데 이번엔 제대도 코로나 터졌는데도 생각보다 또 막 엄청 막,그런데 이번엔 제대도 코로나 터져신디도 생각보다 또 막 엄청 막,jj,But this time even though the discharge from the military broke out it was more than I thought," But this time, even though I was discharged from the army, the corona broke out, but it was much more difficult than I thought."
220554,얼마전에 야 너 그거 해놨으면 쫄딱 망하고 엄마는,얼마전에 야 너 그거 해놔시면 쫄딱 망하고 엄마는,jj,Not long ago if you did that you would go bad and mom," Hey, a while ago, if you did that, you would be ruined and your mother would"
292990,그러니깐 있잖아 이게 다 효과도 없는 것 같은데,그니깐 있네 이게 다이 효과도 없는 것 같은디,jj,"You know, I don't think that's gonna work."," So hey, I don't think all of this has any effect."
193126,어제 남자친구랑 같이 갔다 왔잖아 남자친구는 그냥 짐 한 곳에만 몰아 놓고 드러눕는 거야,어제 남자친구랑 같이 갔다 왔네? 남자친구는 그냥 짐 한 곳에만 몰아 놓고 드러눕는 거라,jj,"You came with your boyfriend last night, and he's just driving one of his bags and lying down.", Yesterday I went with my boyfriend. My boyfriend just puts his luggage in one place and lies down.
291124,깁스하고 이제 병원에 이제 와서,기부스허고 이제 병원에 이제 와네,jj,Gibbs and now you're at the hospital., Put on a cast and now come to the hospital
195204,내가 무슨 여기 커피타러 와서? 경리하러 왔지 생각해서,나가 무신 이디 커피타래 와서? 경리허래 왔주 생각해네,jj,What am I doing here for coffee?, Why am I here for coffee? I thought I came to race
199072,xxxxxxx 아니 고모부가 생각을 잘했어 노조 다닐 때,xxxxxxx 아니 고모부가 생각을 잘핸 노조 다닐 때,jj,"When my aunt thought well, it was xxxxxx."," xxxxxxx No, my uncle had a good idea when he was at the union"
203363,꼬셔보려고 하니까 할머니도 약아서 약은 생각으로 할아버지한테,꼬셔보젠 허난 할망도 욕안이 욕은 실계로 하르방신디,jj,"I was trying to seduce her, and she was so weak that I thought about her medicine."," I tried to seduce him, but the grandmother was also weak."
184043,너 너 &name이하고 잘 지내고 나하고도 지금 말 잘 통하는데.,너 너 &name이하고 잘 지내고 나하고도 지금 말 잘 통하는디.,jj,You're good with &name and you're good with me right now.," You get along well with &name, and you and I talk well now."
308474,너 어떻게 해서 제수씨한테 이렇게 김치 잘합니까 하니까,너 어떵 해여넨 제수씨한테 이추륵 김치 잘햄시니 하난,jj,How can you be so good to your sister-in-law?, How did you tell Jesu that you are so good at making kimchi?
242912,그렇게 하고#예 그러세요 여사님이라고 해요,겅 하고예 그러세요 여사님이라고 함수다,jj,Do it and should you say sir,"Do that#yes yes, call me Mrs."
304222,아~ 뭔말인지 알겠어,아~ 뭔말인지 알크라,jj,I know what you're talking about., Ah I know what you mean
286128,생긴 것도 완전 점성술사 완전 막 빡빡이에,생긴 것도 완전 점성술사 완전 막 빡빡이에이,jj,"I mean, he looks like an ass, and he's so tight, he's like, ""Oh, no, no, no, no, no, no, no, no, no, no, no, no, no, no, no, no, no, no, no, no, no, no, no, no, no, no, no, no, no, no, no, no, no, no, no, no, no, no, no, no, no, no, no, no, no, no, no, no, no, no, no, no, no, no, no, no, no, no, no, no, no, no, no, no, no, no, no, no, no, no, no, no, no, no, no, no, no, no, no, no, no, no, no, no, no, no, no, no, no, no, no, no, no, no, no, no, no, no, no, no, no, no, no, no, no, no, no, no, no, no, no, no, no, no, no, no, no, no, no, no, no, no, no, no, no, no, no, no, no, no, no, no, no, no, no, no, no, no, no, no, no, no, no, no, no, no, no, no, no, no, no, no, no, no, no, no, no, no, no, no, no, no, no, no, no, no, no, no, no, no, no, no, no, no, no, no, no, no, no, no, no, no, no, no, no, no, no, no, no, no, no, no, no, no, no, no, no, no, no, no, no, no, no, no, no, no, no, no, no, no, no, no, no, no, no, no, no, no, no, no, no, no, no, no, no, no, no, no, no, no, no, no, no, no, no, no, no, no, no, no, no, no, no", What he looks like is a complete astrologer
316097,좀 어느정도 많이 친한 애랑 가야 될 거 같아,좀 어느정도 많이 친한 애랑 가야 될 거 닮아,jj,I think I'm gonna have to go with a little more of my best friend., I think I'll have to go with someone I'm close to
153513,기다렸던 게 원래 기다려야 되는거야,기다렸던 게 원래 기다려야 되는거,jj,What you're waiting for is what you're supposed to wait for., What I've been waiting for is originally supposed to wait
305889,통장에 넣어봐야 그 언제 다 누가 썼는지 모르게 없어졌어 없어졌더라고,통장에 넣어봐야 그 언제 다 누가 썼는지 모르게 없어졌부런 없어졌더라고,jj,It's gone. It's gone. It's gone. It's gone.," Even if I put it in my bank account, I don't know when or who used it, it's gone."
260249,살아있을 때 모양으로 대문을 만드는 거야,살아이실 때 모냥으로 대문을 만드는 거야,jj,Its a gate in a shape when youre alive," When I'm alive, I'll make a gate with the shape"
240900,아유 저번엔 또 아이들 시험이긴 했는데 아휴 막 오래 떠들지는 않으니깐,아유 저번엔 또 아이들 시험이긴 해신디 아휴 막 오래 떠들지는 않으니깐,jj,Oh it was another childrens test last time but I dont talk long," Ayu, the other day it was the children's test, but ah, I don't talk for long."
162481,공부거 접어서,공부거 접어부난,jj,I'm gonna fold up my studies., fold study
256946,그니까 너 같이 가서,게난 너 같이 가그냉,jj,Yeah you go with me, so go with you
245180,세계보건지구에서 지정 해서,세계보건지구에서 지정 행으네,jj,Designated by the World Health Organization, designated by the World Health Organization
215791,너 할 얘기 많다면서 나한테,너 할 얘기 많다매 나한테,jj,You said you had a lot to say to me, You said you had a lot to say to me
149125,그거 연애의 온도 봤어? 연애의 온도 영화,그거 연애의 온도 봔? 연애의 온도 영화,jj,Did you see the temperature of love?, Did you see the temperature of love? temperature of love movie
304032,일부러 하루 익혔어 일부러 하루 익혀서 들여놨지,일부러 하루 익현 일부러 하루 익혀넹 들여놨지,jj,One day on purpose. One day on purpose., I cooked it for a day on purpose I cooked it for a day on purpose and brought it in
187614,치매는 아니 치매는 아니예요,치매는 아니 치매는 아니우다,jj,"Not dementia, not dementia.", no dementia no dementia
250994,선수들의 개인 돈 지출해서 이거 하는건데,선수들의 개인 돈 지출해서 이거 하는건디,jj,Its because the players spend their own money, I'm doing this with the players' personal money.
185916,근데 진짜 뭔가 아 뭐 잘 보냈다 조금 이런 게 조금 웃기긴 했어,근데 진짜 뭔가 아 뭐 잘 보냈다 조금 이런 게 조금 웃기긴 핸,jj,But I really sent him something. It was a little funny.,But really something ah well I had a good time It was a little bit funny
47593,제가 이제 좋아하거든요.,제가 인제 좋아하거든요.,jd,I like it now., I like it now.
5772,교양인은 음악가가 될 수 없었다고 해 부드 해야 해 버리네.,교양인은 음악가가 될 수 없었다고 해 부드 해야 해 부네.,jd,The Tao-soo can't be a musician. He has to be fed.," It is said that a cultured person could not become a musician, so he has to be gentle."
28194,에휴 이렇게 봐서는,에휴 이릏게 봐서는,jd,"Oh, my God, you look like this."," Eh, looking at it like this"
47570,자기가 해서 먹을라고 하고 난 또 내가 해서 먹으려고해.,자기가 해서 먹을라고 하고 난 또 내가 해서 묵을라게.,jd,"He says he wants to eat it, and I want to eat it."," He tells me to make it and eat it, and I try to make it myself and eat it."
43975,뭐 그냥,뭐 걍,jd,It's just..., what just
79221,뒤에도 약간 조금 긁어먹은 게 있어 그래서 처음에 약간 그~,뒤에도 약간 쫌 긁어먹은 게 있어 그래서 처음에 약간 그~,jd,"There's a little bit of scratch in the back, so I'm just a little bit of a scratch at first."," There is also a bit of scratching on the back, so at first a little bit"
278355,지금은 물론 엄청 잘 살아 거의 재벌급이야,지금은 물론 엄청 잘 살아 거의 재벌급이여,jd,Now of course Im almost like a chaebol," Now, of course, I am living very well, almost at the level of a conglomerate."
26726,그래도 김치 씻어 먹으면 좋지?,그래도 김치 씻어 먹으믄 좋제?,jd,But why don't you wash your face?," Still, is it good to wash and eat kimchi?"
62201,내가 자기를 잘 만났다고 그러더라고.,내가 자기를 잘 만났다고 글드라고.,jd,He said I met him very well., He said that I met him well.
85208,안 해도 그렇고 그러니까 좀 조율하기가 힘드니까,안 해도 그렇고 근까 좀 조율하기가 힘드니까,jd,"I mean, it's a little hard to tune."," It's okay if you don't do it, so it's a bit difficult to coordinate"
63846,최근에는 뭐 공공기관이라든지 그다음에 또 이제 그것은 거물급,최근에는 뭐 공공기관이라든지 그다음에 또 인제 그것은 거물급,jd,"And recently, public institutions, and then it's kind of a big deal."," Recently, it is a public institution or something, and then again, it is a heavyweight"
37517,그리고 우리는 그~,그러고 우리는 그~,jd,"And we, uh...", and we that
59518,그리고 이제 뭐 그러니까 같이 술 먹자 이런 식일 때 말을 해야 되잖아 남자친구가 있다 이런 식으로,그러고 이제 뭐 그니까 같이 술 먹자 이런 식일 때 말을 해야 되잖아 남자친구가 있다 이런 식으로,jd,"And now, you know, we're gonna get drunk together, and we're gonna have to talk to each other at this point, and we have a boyfriend like this."," And now, well, let's have a drink together, you have to talk when you're like this."
35929,개 성격도 있고 그냥 기본적인 바탕이 조금 되니까는 그냥,개 성격도 있고 그냥 기본적인 바탕이 쫌 됭께는 그냥,jd,"It's got a dog personality, and it's just a little bit of a basic basis."," It has a dog personality, and it's just a little bit of a basic background, so it's just"
95940,아니 그러니까 저기 뭐냐,아니 긍께 저기 뭐냐,jd,"No, no, no, no, no, no, no, no, no, no, no, no, no, no, no, no, no, no, no, no, no, no.",no so what is it
205851,즉 본인에게 반한 백마 탄 왕자님을 만나서 자신의 미래를 바꾸고 인생이 -편- 편해진다고 생각나는 증세인 거야.,즉 본인에게 반한 백마 탄 왕자님을 만나서 자신의 미래를 바꾸고 인생이 -편- 편해진다고 생각나는 증세인 겨.,jd,"That's when you meet the prince of the White Horse who has a crush on you, and you change your future, and you think that life is going to be comfortable."," In other words, it is a symptom that reminds you that meeting a prince on a white horse who has a crush on you will change your future and make your life -comfortable-."
322429,그래서 이제 그때부터 내가 마음을 달리 먹었지.,그래서 인자 그때부터 내가 마음을 달리 먹었지.,jd,So Ive been decided on a different mind since then," So, since then, I have changed my mind."
27715,머리 감을 때는 진짜 무슨 빗자루 만지는 것 마냥 애가 머리에,머리 깜을 때는 진짜 무슨 빗자루 만지는 것 마냥 애가 머리에,jd,"When she closes her hair, she's like she's touching a broom on her head."," When you wash your hair, it really feels like you are touching a broom."
11130,오는데 이제 친구가 이제 친구 아줌마가,오는데 이제 친구가 인자 친구 아줌마가,jd,"And now a friend of mine says,"," I'm coming, now my friend, now my friend's lady"
54474,거기가 무슨 부대에 이 그러니까 그런 부대가 있어요 뭐 하는 부대인데요?,거기가 무슨 부대에 이 그니까 그런 부대가 있어요 뭐 하는 부대인데요?,jd,What kind of unit is that?, What kind of unit is that?
38824,서울에서 아르바이트 찾기가 힘든 거야 언니.,서울에서 알바 찾기가 힘든 거야 언니.,jd,It's hard to find a part-time job in Seoul.," It's hard to find a part-time job in Seoul, sister."
68791,만약 그 게임이 극딜을 갔으면 너 그냥 그 큐 랑 더블유  쌨을 걸,만약 그 게임이 극딜을 갔으면 니 그냥 그 큐 랑 더블유  쌨을 걸,jd,"If the game had gone to the farthest point, you would've just gone to the Kew and the double oil."," If the game went to the extreme, you'd just play that cue and W."
281831,그게 그렇게 되더라고,그게 그렇게 되드라고,jd,Thats how it worked, that's how it happened
52709,한 선수가 공을 잡고,한 선수가 꽁을 잡고,jd,One player takes the ball., A player catches the ball
32828,그러니까 나는 그 말이 참 마음에 와 닿는 거 같아.,근까 나는 그 말이 참 마음에 와 닿는 거 같아.,jd,So I think that sounds very appealing to me., So I think that word really touches my heart.
30766,제일 작은 방에서 하기는 또 -팔- 팔이 또 안 펴지고 하니까 레지나 방이 좋긴 하거든.,제일 짝은 방에서 하기는 또 -팔- 팔이 또 안 펴지고 하니까 레지나 방이 좋긴 하거든.,jd,"I don't want to do it in the smallest room because my arms don't open again, so I like Regina's room.", Regina's room is good because I can't straighten my arms again to do it in the smallest room.
36505,너무 부드러워가지고 그것도,너무 부드러워가지고 그것도잉,jd,It's so soft., It's too soft and that too
22770,취득세가 엄청 일 가 구 일 사 삼 이제,취득세가 엄청 일 가 구 일 사 삼 인자,jd,"There's a lot of work going on, and now there's a lot of work going on.",Acquisition tax is exorbitant
65262,나는 어릴 때부터 동물을 엄청 좋아했어.,나는 어릴 때부터 동물을 엄청 좋아혔어.,jd,I've loved animals since I was a kid., I've been very fond of animals since I was little.
71951,그러니까 나 스스로 노력은 하고 있어 그 부동산에,긍께 나 스스로 노력은 하고 있어 그 부동산에,jd,That's why I'm trying on my own., That's why I'm working hard on that real estate
323832,아 나도 메이크업은 잘 안하지. 메이크업 하면 그러니까 나도,아 나도 메이크업은 잘 안하지. 메이크업 하면 긍까 나도,jd,Oh I dont usually do makeup either If I do makeup I," Oh, I'm not good at makeup either. When it comes to makeup, so do I"
53836,그랬더니 결국 또 뽑아온다고 서 너번 이야기하길래,그랬더니 기언이 또 뽑아온다고 서 너번 얘기허길래,jd,And then he told me three or four times that he was coming back.," Then, in the end, he told me again that he would pick it up again."
2279,무 이렇게 비싸냐고 장난감이 이십이만 원이야.,무 이렇게 비싸냐고 장난감이 이십이만 원이여.,jd,"No, no, no, no, no, no, no, no, no, no, no, no, no, no, no, no, no, no, no, no, no, no, no, no, no, no, no, no, no, no, no, no, no, no, no, no, no, no, no, no, no, no, no, no, no, no, no, no, no, no, no, no, no, no, no, no, no, no, no, no, no, no, no, no, no, no, no, no, no, no, no, no, no, no, no, no, no, no, no, no, no, no, no, no, no, no, no, no, no, no, no, no, no, no, no, no, no, no, no, no, no, no, no, no, no, no, no, no, no, no, no, no, no, no, no, no, no, no, no, no, no, no, no, no, no, no, no, no, no, no, no, no, no, no, no, no, no, no, no, no, no, no, no, no, no, no, no, no, no, no, no, no, no, no, no, no, no, no, no, no, no, no, no, no, no, no, no, no, no, no, no, no, no, no, no, no, no, no, no, no, no, no, no, no, no, no, no, no, no, no, no, no, no, no, no, no, no, no, no, no, no, no, no, no, no, no, no, no, no, no, no, no, no, no, no, no, no, no, no, no, no, no, no, no, no, no, no, no, no, no, no, no, no, no, no, no, no, no, no, no, no, no, no, no, no, no, no, no, no, no, no, no, no, no, no,"," Why is it so expensive? A toy costs 220,000 won."
324870,우리 딸이 딱 보드만 아주 제 아기처럼 그놈 키우고,우리 딸이 딱 보드만 아주 지 얘기마냥 그놈 키우고,jd,My daughter raises her on the board like my baby," My daughter raised him just like my baby, just a board."
266561,배송도 늦게 오고 막 그랬다매 그런데 국내산 제품을 쓰면은 그럴 일이 없어.,배송도 늦게 오고 막 그랬다매 근디 국내산 제품을 쓰면은 그럴 일이 없시야.,jd,The delivery came late and it was like that but if you use domestic products that wont happen," Delivery came late and was just like that, but there is no such thing as using domestic products."
22875,그런데 우리가 정말로,그런데 우리가 참말로,jd,But we really don't know what to do., But we really
30521,겨울이면은 원수지간이야.,겨울이믄은 웬수지간이야.,jd,Winter is an enemy.," In winter, they are enemies."
6196,그거는 항상 나의 그~ 필수품이야 근데 목티를 입으면은 말이야 막,그거는 항상 나의 그~ 필수품이여 근데 목티를 입으면은 말이여 막,jd,"That's always what I need, but when I put on my neck, I don't know."," That's always my must-have, but when I wear a neck tee"
79371,한시간 동안 그래야 이제 더욱 무리하면은 더 무릎이 아픈 것 같더라 날마다?,한시간 동안 그래야 이제 더욱 무리하면은 더 무릎이 아픈 것 같드라 날마다?,jd,"It's been an hour, and now it's like my knee's getting sicker if I'm even harder."," If you do it for an hour, now it seems like your knees hurt more if you overdo it. Every day?"
22919,그때 아마 저스디스가 래 가장 힘들 때야.,그때 아마 저스디스가 래 가장 힘들 때여.,jd,It's probably the hardest time she's ever had., That's probably the hardest time for Just This.
12866,여기서 생활하고 잉,여서 생활하고 잉,jd,I'm living here., living here
335067,그러니까 지금까지 한 건 받고 그만둬야지,그니까 지금까지 한 건 받고 그만둬야지,jd,So you have to stop one so far,"So, take what you've done so far and quit."
51863,그거 조그마해 가지고 아빠 잃어 버릴 것 같은데?,그거 째깐해 가지고 아빠 잃어 버릴 것 같은데?,jd,I think it's a little thing and I think I'm gonna lose my dad., Do you think you'll lose your dad with that little thing?
37184,그냥 이단까지만 하자 얘기까지만 해라 그리고 난 이제 이단에서 끝냈지요.,그냥 이단까지만 하자 얘기까지만 해라 그러고 난 이제 이단에서 끝냈지요.,jd,"Let's just get to Ethan, and I'm done here.", Let's just go to heresy. Let's just talk about heresy.
333350,기능을 하는데 손목시계 형태를 하고 있기에 화면 크기가 한정적으로 입출력 환경이 제한될 수밖에 없으나,기능을 하는디 손목시계 형태를 하고 있기에 화면 크기가 한정적으로 입출력 환경이 제한될 수밖에 없으나,jd,Since it is in the form of a wristwatch to function the inputoutput environment is limited due to the limited screen size," Since the function is in the form of a wristwatch, the screen size is limited and the input/output environment is inevitably limited."
270086,그러니까 건축물도 남들이 흉내 낼 수 없는 그런 건축물에 대해 머릿속에서 나오는 거고,그니까 건축물도 남들이 흉내 낼 수 없는 그런 건축물에 대해 머릿속에서 나오는 거고,jd,So even architecture comes from my head about such architecture that others cant imitate," That is to say, the architecture comes from the head about the kind of architecture that others cannot imitate."
54829,어디서 났냐 나한테 그러는 거야.,어서 났냐 나한테 그러는 거야.,jd,Where'd you get it? He's doing it to me., Where did you come from? Are you doing this to me?
36196,고전 옛날 서양 그~ 중세시대 그런 걸 또 좋아해.,고전 옛날 서양 그~ 중세시대 그런 걸 또 좋아혀.,jd,like the Old West and the Middle Ages.," I like classics, westerns, medieval times, and stuff like that."
46,이~ 여름에는 상관없는데 인제 겨울에는 인제 환기시킬 때마다 조금 많이 추워가지고,이~ 여름에는 상관없는데 인제 겨울에는 인제 환기시킬 때마다 쫌 많이 추워가지고,jd,"It doesn't matter in summer, because every winter it's a little bit cold."," It doesn't matter in summer, but in winter, it gets a little cold every time you ventilate."
50098,뭐냐 운암동 쪽 지나오잖아 그러면 안오는데 첨단쪽이 눈이 유난히 많이 오는데 택시 기사 아저씨도 그 얘기 하더구먼,뭐냐 운암동 쪽 지나오잖아 그먼 안오는데 첨단쪽이 눈이 유난히 많이 오는데 택시 기사 아저씨도 그 얘기 하드마,jd,"I mean, you're coming through the WWWW, and you're not coming back, but there's a lot of high-tech eyes, and the cab driver told me about it."," You pass by Unam-dong, then you don't come, but it snows a lot in Cheomdan, and the taxi driver said that too."
325371,그~ 피곤한 것도 덜 하고 그러더라고,그~ 피곤한 것도 덜 허고 글더라고,jd,He didnt do anything tired, That's why I'm less tired
38640,자기랑 같이 있자고 그래 가지고 @웃음,지랑 같이 있자고 그래 가지고 @웃음,jd,You want me to stay with you?,He said let's stay with him @laugh
50703,가족끼리 가는 여행을 나는 좀 좋아해.,가족끼리 가는 여행을 나는 쫌 좋아해.,jd,I like the family trip., I kind of like traveling with my family.
59882,뭐~ 저기 파충류를 키우고 싶다 그래서 파충류도 사줘 다 선물이야 선물,뭐~ 저기 파충류를 키우고 싶다 그래서 파충류도 사줘 다 선물이여 선물,jd,"Well, I'd like to raise a reptile over there, so I'd like to buy a reptile for you. It's all a gift."," Well~ Hey, I want to raise a reptile, so I bought a reptile too. Everything is a gift."
98963,나 깔끔한 게 좋은데.,나 깔끔한 게 좋은디.,jd,I like being clean., I like being tidy.
266429,그런 암튼 많은 조금 다름이 있네,그런 암튼 많은 쫌 다름이 있네,jd,Anyway theres a lot of difference," Anyway, there are many little differences"
